{
  "fixture_id": "real-047",
  "repository": "openai/openai-python",
  "rubric_version": "m8-label-rubric-v1.0.0",
  "evaluator_id": "reviewer_b",
  "label_source": "ai_review",
  "human_verified": false,
  "gold_role": "none",
  "scores": {
    "overall": 5,
    "seo": 5,
    "aeo": 4,
    "geo": 4
  },
  "rationale": {
    "overall": "reviewer_b: Holistic discoverability assessed at 5/5. Meets high-quality professional threshold based on evidence synthesis across surfaces.",
    "seo": "reviewer_b: SEO rated 5/5. Findings: valid root license file, rich heading hierarchy, substantial content length, and complete metadata, exemplary discoverability surface with changelog, contributing, and comprehensive metadata.",
    "aeo": "reviewer_b: AEO rated 4/5. Direct answers verified for 4/5 canonical questions: Q2 (Who is it for?) target audience identified, Q3 (What does it do?) clear capabilities, Q4 (How is it used?) install & quickstart provided, Q5 (Prerequisites) runtime/ecosystem facts explicit.",
    "geo": "reviewer_b: GEO rated 4/5. Machine citability supported by: 48 code block(s) present, syntax-highlighted code fences, structured comparison or API tables, extended docs or runnable examples."
  },
  "reviewed_at": "2026-09-08T12:31:37.589Z"
}