{
  "fixture_id": "real-082",
  "repository": "facebook/docusaurus",
  "rubric_version": "m8-label-rubric-v1.0.0",
  "evaluator_id": "reviewer_a",
  "label_source": "ai_review",
  "human_verified": false,
  "gold_role": "none",
  "scores": {
    "overall": 3,
    "seo": 4,
    "aeo": 4,
    "geo": 2
  },
  "rationale": {
    "overall": "reviewer_a: Holistic discoverability assessed at 3/5. Meets competent standard open-source threshold based on evidence synthesis across surfaces.",
    "seo": "reviewer_a: SEO rated 4/5. Findings: valid root license file, rich heading hierarchy, substantial content length, and complete metadata.",
    "aeo": "reviewer_a: AEO rated 4/5. Direct answers verified for 4/5 canonical questions: Q2 (Who is it for?) target audience identified, Q3 (What does it do?) clear capabilities, Q4 (How is it used?) install & quickstart provided, Q5 (Prerequisites) runtime/ecosystem facts explicit.",
    "geo": "reviewer_a: GEO rated 2/5. Machine citability supported by: 1 code block(s) present, extended docs or runnable examples."
  },
  "reviewed_at": "2026-09-08T12:31:34.803Z"
}