{
  "fixture_id": "real-097",
  "repository": "numpy/numpy",
  "rubric_version": "m8-label-rubric-v1.0.0",
  "evaluator_id": "reviewer_a",
  "label_source": "ai_review",
  "human_verified": false,
  "gold_role": "none",
  "scores": {
    "overall": 1,
    "seo": 1,
    "aeo": 1,
    "geo": 1
  },
  "rationale": {
    "overall": "reviewer_a: Holistic discoverability assessed at 1/5. Meets below-average threshold based on evidence synthesis across surfaces.",
    "seo": "reviewer_a: SEO rated 1/5. Findings: basic discoverability signals.",
    "aeo": "reviewer_a: AEO rated 1/5. Direct answers verified for 1/5 canonical questions: Q5 (Prerequisites) runtime/ecosystem facts explicit.",
    "geo": "reviewer_a: GEO rated 1/5. Machine citability supported by: minimal factual structures."
  },
  "reviewed_at": "2026-09-08T12:31:34.803Z"
}