{
  "fixture_id": "real-073",
  "repository": "donnemartin/system-design-primer",
  "rubric_version": "m8-label-rubric-v1.0.0",
  "evaluator_id": "reviewer_b",
  "label_source": "ai_review",
  "human_verified": false,
  "gold_role": "none",
  "scores": {
    "overall": 2,
    "seo": 1,
    "aeo": 4,
    "geo": 2
  },
  "rationale": {
    "overall": "reviewer_b: Holistic discoverability assessed at 2/5. Meets below-average threshold based on evidence synthesis across surfaces.",
    "seo": "reviewer_b: SEO rated 1/5. Findings: basic discoverability signals.",
    "aeo": "reviewer_b: AEO rated 4/5. Direct answers verified for 4/5 canonical questions: Q1 (What is it?) answered definitional pitch, Q2 (Who is it for?) target audience identified, Q3 (What does it do?) clear capabilities, Q4 (How is it used?) install & quickstart provided.",
    "geo": "reviewer_b: GEO rated 2/5. Machine citability supported by: 9 code block(s) present, structured comparison or API tables, explicit comparison / benchmark section."
  },
  "reviewed_at": "2026-09-08T12:31:37.589Z"
}