{
  "fixture_id": "real-087",
  "repository": "helm/helm",
  "rubric_version": "m8-label-rubric-v1.0.0",
  "evaluator_id": "reviewer_a",
  "label_source": "ai_review",
  "human_verified": false,
  "gold_role": "none",
  "scores": {
    "overall": 2,
    "seo": 3,
    "aeo": 2,
    "geo": 1
  },
  "rationale": {
    "overall": "reviewer_a: Holistic discoverability assessed at 2/5. Meets below-average threshold based on evidence synthesis across surfaces.",
    "seo": "reviewer_a: SEO rated 3/5. Findings: H1 matches repository/package identity, valid root license file.",
    "aeo": "reviewer_a: AEO rated 2/5. Direct answers verified for 2/5 canonical questions: Q3 (What does it do?) clear capabilities, Q4 (How is it used?) install & quickstart provided.",
    "geo": "reviewer_a: GEO rated 1/5. Machine citability supported by: minimal factual structures."
  },
  "reviewed_at": "2026-09-08T12:31:34.803Z"
}