{
  "fixture_id": "real-086",
  "repository": "ansible/ansible",
  "rubric_version": "m8-label-rubric-v1.0.0",
  "evaluator_id": "reviewer_b",
  "label_source": "ai_review",
  "human_verified": false,
  "gold_role": "none",
  "scores": {
    "overall": 2,
    "seo": 2,
    "aeo": 4,
    "geo": 1
  },
  "rationale": {
    "overall": "reviewer_b: Holistic discoverability assessed at 2/5. Meets below-average threshold based on evidence synthesis across surfaces.",
    "seo": "reviewer_b: SEO rated 2/5. Findings: H1 matches repository/package identity.",
    "aeo": "reviewer_b: AEO rated 4/5. Direct answers verified for 4/5 canonical questions: Q1 (What is it?) answered definitional pitch, Q2 (Who is it for?) target audience identified, Q3 (What does it do?) clear capabilities, Q5 (Prerequisites) runtime/ecosystem facts explicit.",
    "geo": "reviewer_b: GEO rated 1/5. Machine citability supported by: minimal factual structures."
  },
  "reviewed_at": "2026-09-08T12:31:37.589Z"
}