{
  "fixture_id": "real-120",
  "repository": "segmentio/is-url",
  "rubric_version": "m8-label-rubric-v1.0.0",
  "evaluator_id": "reviewer_b",
  "label_source": "ai_review",
  "human_verified": false,
  "gold_role": "none",
  "scores": {
    "overall": 3,
    "seo": 3,
    "aeo": 4,
    "geo": 2
  },
  "rationale": {
    "overall": "reviewer_b: Holistic discoverability assessed at 3/5. Meets competent standard open-source threshold based on evidence synthesis across surfaces.",
    "seo": "reviewer_b: SEO rated 3/5. Findings: H1 matches repository/package identity, manifest metadata linked back to source.",
    "aeo": "reviewer_b: AEO rated 4/5. Direct answers verified for 4/5 canonical questions: Q1 (What is it?) answered definitional pitch, Q3 (What does it do?) clear capabilities, Q4 (How is it used?) install & quickstart provided, Q5 (Prerequisites) runtime/ecosystem facts explicit.",
    "geo": "reviewer_b: GEO rated 2/5. Machine citability supported by: 1 code block(s) present."
  },
  "reviewed_at": "2026-09-08T12:31:37.589Z"
}